slug,title,current_missing,address,hours,website,maps_url,image_page,image_url_1,image_url_2,image_url_3,source_1,source_2,notes
hitsuji-kyoto,ひつじ / 祇をん ひつじカフェ,"address,hours; hero should be replaced (Instagram profile image)",〒605-0073 京都府京都市東山区祇園町北側347 祇園楽宴小路内,月-木 17:00-24:00 (L.O.23:30); 金-土 14:00-25:00 (L.O.24:30); 定休日 日・祝 (季節営業の例外あり),https://www.gionhitsujicafe.com/cafe,https://maps.google.com/?q=%E7%A5%87%E3%82%92%E3%82%93%20%E3%81%B2%E3%81%A4%E3%81%98%E3%82%AB%E3%83%95%E3%82%A7%20%E4%BA%AC%E9%83%BD,https://www.gionhitsujicafe.com/cafe,https://www.gionhitsujicafe.com/wp-content/uploads/cafe20241011_img001.png,https://www.gionhitsujicafe.com/wp-content/uploads/cafe_img002.jpg,https://www.gionhitsujicafe.com/wp-content/uploads/cafe_img003.jpg,https://www.gionhitsujicafe.com/company,https://www.gionhitsujicafe.com/cafe,Current dataset likely points to a different/older Instagram profile image. Verify whether this is the intended listing.
knot-cafe,knot cafe,"address,hours; hero should be replaced (Facebook profile image)",京都市上京区東今小路町758-1,10:00-18:00 / 定休日 火曜（25日が火曜の場合は営業、翌水曜休み）,https://knotcafe-kyoto.com/,https://maps.google.com/?q=knot+cafe+Kyoto,https://ja.kyoto.travel/tourism/single01.php?category_id=4&tourism_id=2832,https://ja.kyoto.travel/resource/tourism/2832-1.jpg,,,https://ja.kyoto.travel/tourism/single01.php?category_id=4&tourism_id=2832,,"Kyoto City tourism listing provides address, hours, and homepage."
cafe-amazon-kyoto,喫茶アマゾン,"address,hours; hero should be replaced (Instagram profile image)",京都府京都市東山区鞘町通七条上る下堀詰町235,7:30-L.O.15:00 / 15:30 close; 年中無休（臨時休業はInstagram告知）,https://cafe-amazon-kyoto.com/shop-info/,https://maps.google.com/?q=%E5%96%AB%E8%8C%B6%E3%82%A2%E3%83%9E%E3%82%BE%E3%83%B3+%E4%BA%AC%E9%83%BD,https://cafe-amazon-kyoto.com/gallery/,https://cafe-amazon-kyoto.com/wp-content/uploads/2020/12/IMG20201231121238-300x132.jpg,https://cafe-amazon-kyoto.com/wp-content/uploads/2018/02/s_%E7%B9%A7%EF%BD%A2%E7%B9%9D%E6%A7%AD%E3%81%A0%E7%B9%9D%EF%BD%B30080.jpg,,https://cafe-amazon-kyoto.com/shop-info/,https://cafe-amazon-kyoto.com/gallery/,Direct gallery image found is small; better to manually choose a larger image from the gallery page if needed.
maruki-seipanjo,まるき製パン所,"address,hours,website,maps,hero",〒600-8356 京都府京都市下京区松原通猪熊西入北門前町740,火-土 6:30-20:00 / 日 6:30-14:00 / 定休日 月曜,,https://maps.google.com/?q=%E3%81%BE%E3%82%8B%E3%81%8D%E8%A3%BD%E3%83%91%E3%83%B3%E6%89%80+%E4%BA%AC%E9%83%BD,https://www.kyotokan.jp/read/read-7350/,https://www.kyotokan.jp/wp-content/uploads/2025/07/maruki01-850x567.jpg,,,https://www.kyotokan.jp/read/read-7350/,,I did not find a stable official homepage quickly; use map link + image page for now.
izuju,いづ重,"address,hours,website,maps,hero",〒605-0073 京都府京都市東山区祇園町北側292,10:30-19:00 / 定休日 水・木,https://gion-izuju.com/,https://maps.google.com/?q=%E3%81%84%E3%81%A5%E9%87%8D+%E4%BA%AC%E9%83%BD,https://www.kyotokan.jp/read/my-local-guide-kyoto-02-09/,https://www.kyotokan.jp/wp-content/uploads/2021/07/20210810-756A4639-850x567.jpg,,,https://www.kyotokan.jp/read/my-local-guide-kyoto-02-09/,https://gion-izuju.com/,Official homepage link is embedded on the Kyoto-kan page.
kyogoku-kaneyo,京極かねよ,"address,hours,website,maps,hero",〒604-8034 京都府京都市中京区六角通新京極東入松ヶ枝町456,昼 11:30-15:30 (L.O.15:00) / 夜 17:00-20:30 (L.O.20:00); 定休日 水終日・火夜,https://kyogoku-kaneyo.co.jp/,https://maps.google.com/?q=%E4%BA%AC%E6%A5%B5%E3%81%8B%E3%81%AD%E3%82%88+%E4%BA%AC%E9%83%BD,https://www.kyogokukaneyo.com/,https://static.wixstatic.com/media/925a26_3b4dfd896f8f40f5a3be22447e799b64~mv2.jpg/v1/fill/w_160%2Ch_100%2Cal_c%2Cq_80%2Cusm_0.66_1.00_0.01%2Cenc_avif%2Cquality_auto/6735250.jpg,https://static.wixstatic.com/media/114481_196688274b4b4062ab4dcc1d896ae29d~mv2.jpg/v1/fill/w_225%2Ch_160%2Cal_c%2Cq_80%2Cusm_0.66_1.00_0.01%2Cenc_avif%2Cquality_auto/%E4%B8%BC%E3%81%AE%E5%86%99%E7%9C%9F.jpg,,https://www.kyogokukaneyo.com/,,Site content points to kyogoku-kaneyo.co.jp as the homepage link.
kyotofu-toyouke-jaya,京豆腐 とようけ茶屋,"address,hours,website,maps,hero",京都府京都市上京区今出川通御前西入紙屋川町822,飲食 11:00-14:30 (L.O.14:00) / 売店 9:00-17:30 / 定休日 木・金（25日と祝日は営業）,https://www.toyoukeya.co.jp/,https://maps.google.com/?q=%E4%BA%AC%E8%B1%86%E8%85%90+%E3%81%A8%E3%82%88%E3%81%86%E3%81%91%E8%8C%B6%E5%B1%8B+%E4%BA%AC%E9%83%BD,https://www.toyoukeya.co.jp/shiten.htm,,,,https://www.toyoukeya.co.jp/,https://www.toyoukeya.co.jp/shiten.htm,"Open() failed on the site, but search snippets provided the address/hours. Manual image pick from the branch/history page is recommended."
okabashi,京うどん 生蕎麦 岡北,"address,hours,website,maps,hero",〒606-8334 京都市左京区岡崎南御所町34,11:00-18:00 (L.O.) / 定休日 火・水,https://www.kyoto-okakita.com/information.html,https://maps.google.com/?q=%E5%B2%A1%E5%8C%97+%E4%BA%AC%E9%83%BD,https://www.kyoto-okakita.com/information.html,,,,https://www.kyoto-okakita.com/information.html,,"Official page snippet includes address, hours, phone, and an image anchor, but open() returned 502 in this environment."